{
  "$schema": "https://ui.shadcn.com/schema/registry-item.json",
  "name": "toggle-group",
  "registryDependencies": [
    "toggle"
  ],
  "files": [
    {
      "path": "registry/base-nova/ui/toggle-group.tsx",
      "content": "\"use client\"\n\nimport * as React from \"react\"\nimport { Toggle as TogglePrimitive } from \"@base-ui/react/toggle\"\nimport { ToggleGroup as ToggleGroupPrimitive } from \"@base-ui/react/toggle-group\"\nimport { type VariantProps } from \"class-variance-authority\"\n\nimport { cn } from \"@/registry/base-nova/lib/utils\"\nimport { toggleVariants } from \"@/registry/base-nova/ui/toggle\"\n\nconst ToggleGroupContext = React.createContext<\n  VariantProps<typeof toggleVariants> & {\n    spacing?: number\n    orientation?: \"horizontal\" | \"vertical\"\n  }\n>({\n  size: \"default\",\n  variant: \"default\",\n  spacing: 0,\n  orientation: \"horizontal\",\n})\n\nfunction ToggleGroup({\n  className,\n  variant,\n  size,\n  spacing = 0,\n  orientation = \"horizontal\",\n  children,\n  ...props\n}: ToggleGroupPrimitive.Props &\n  VariantProps<typeof toggleVariants> & {\n    spacing?: number\n    orientation?: \"horizontal\" | \"vertical\"\n  }) {\n  return (\n    <ToggleGroupPrimitive\n      data-slot=\"toggle-group\"\n      data-variant={variant}\n      data-size={size}\n      data-spacing={spacing}\n      data-orientation={orientation}\n      style={{ \"--gap\": spacing } as React.CSSProperties}\n      className={cn(\n        \"group/toggle-group flex w-fit flex-row items-center gap-[--spacing(var(--gap))] rounded-lg data-[size=sm]:rounded-[min(var(--radius-md),10px)] data-vertical:flex-col data-vertical:items-stretch\",\n        className\n      )}\n      {...props}\n    >\n      <ToggleGroupContext.Provider\n        value={{ variant, size, spacing, orientation }}\n      >\n        {children}\n      </ToggleGroupContext.Provider>\n    </ToggleGroupPrimitive>\n  )\n}\n\nfunction ToggleGroupItem({\n  className,\n  children,\n  variant = \"default\",\n  size = \"default\",\n  ...props\n}: TogglePrimitive.Props & VariantProps<typeof toggleVariants>) {\n  const context = React.useContext(ToggleGroupContext)\n\n  return (\n    <TogglePrimitive\n      data-slot=\"toggle-group-item\"\n      data-variant={context.variant || variant}\n      data-size={context.size || size}\n      data-spacing={context.spacing}\n      className={cn(\n        \"shrink-0 group-data-[spacing=0]/toggle-group:rounded-none group-data-[spacing=0]/toggle-group:px-2 focus:z-10 focus-visible:z-10 group-data-horizontal/toggle-group:data-[spacing=0]:first:rounded-l-lg group-data-vertical/toggle-group:data-[spacing=0]:first:rounded-t-lg group-data-horizontal/toggle-group:data-[spacing=0]:last:rounded-r-lg group-data-vertical/toggle-group:data-[spacing=0]:last:rounded-b-lg group-data-horizontal/toggle-group:data-[spacing=0]:data-[variant=outline]:border-l-0 group-data-vertical/toggle-group:data-[spacing=0]:data-[variant=outline]:border-t-0 group-data-horizontal/toggle-group:data-[spacing=0]:data-[variant=outline]:first:border-l group-data-vertical/toggle-group:data-[spacing=0]:data-[variant=outline]:first:border-t\",\n        toggleVariants({\n          variant: context.variant || variant,\n          size: context.size || size,\n        }),\n        className\n      )}\n      {...props}\n    >\n      {children}\n    </TogglePrimitive>\n  )\n}\n\nexport { ToggleGroup, ToggleGroupItem }\n",
      "type": "registry:ui"
    }
  ],
  "meta": {
    "links": {
      "docs": "https://ui.shadcn.com/docs/components/base/toggle-group",
      "examples": "https://raw.githubusercontent.com/shadcn-ui/ui/refs/heads/main/apps/v4/registry/bases/base/examples/toggle-group-example.tsx",
      "api": "https://base-ui.com/react/components/toggle-group.md"
    }
  },
  "type": "registry:ui"
}