{
  "$schema": "https://ui.shadcn.com/schema/registry-item.json",
  "name": "popover",
  "files": [
    {
      "path": "registry/radix-mira/ui/popover.tsx",
      "content": "\"use client\"\n\nimport * as React from \"react\"\nimport { Popover as PopoverPrimitive } from \"radix-ui\"\n\nimport { cn } from \"@/registry/radix-mira/lib/utils\"\n\nfunction Popover({\n  ...props\n}: React.ComponentProps<typeof PopoverPrimitive.Root>) {\n  return <PopoverPrimitive.Root data-slot=\"popover\" {...props} />\n}\n\nfunction PopoverTrigger({\n  ...props\n}: React.ComponentProps<typeof PopoverPrimitive.Trigger>) {\n  return <PopoverPrimitive.Trigger data-slot=\"popover-trigger\" {...props} />\n}\n\nfunction PopoverContent({\n  className,\n  align = \"center\",\n  sideOffset = 4,\n  ...props\n}: React.ComponentProps<typeof PopoverPrimitive.Content>) {\n  return (\n    <PopoverPrimitive.Portal>\n      <PopoverPrimitive.Content\n        data-slot=\"popover-content\"\n        align={align}\n        sideOffset={sideOffset}\n        className={cn(\n          \"z-50 flex w-72 origin-(--radix-popover-content-transform-origin) flex-col gap-4 rounded-lg bg-popover p-2.5 text-xs text-popover-foreground shadow-md ring-1 ring-foreground/10 outline-hidden duration-100 data-[side=bottom]:slide-in-from-top-2 data-[side=left]:slide-in-from-right-2 data-[side=right]:slide-in-from-left-2 data-[side=top]:slide-in-from-bottom-2 data-open:animate-in data-open:fade-in-0 data-open:zoom-in-95 data-closed:animate-out data-closed:fade-out-0 data-closed:zoom-out-95\",\n          className\n        )}\n        {...props}\n      />\n    </PopoverPrimitive.Portal>\n  )\n}\n\nfunction PopoverAnchor({\n  ...props\n}: React.ComponentProps<typeof PopoverPrimitive.Anchor>) {\n  return <PopoverPrimitive.Anchor data-slot=\"popover-anchor\" {...props} />\n}\n\nfunction PopoverHeader({ className, ...props }: React.ComponentProps<\"div\">) {\n  return (\n    <div\n      data-slot=\"popover-header\"\n      className={cn(\"flex flex-col gap-1 text-xs\", className)}\n      {...props}\n    />\n  )\n}\n\nfunction PopoverTitle({ className, ...props }: React.ComponentProps<\"h2\">) {\n  return (\n    <div\n      data-slot=\"popover-title\"\n      className={cn(\"text-sm font-medium\", className)}\n      {...props}\n    />\n  )\n}\n\nfunction PopoverDescription({\n  className,\n  ...props\n}: React.ComponentProps<\"p\">) {\n  return (\n    <p\n      data-slot=\"popover-description\"\n      className={cn(\"text-muted-foreground\", className)}\n      {...props}\n    />\n  )\n}\n\nexport {\n  Popover,\n  PopoverAnchor,\n  PopoverContent,\n  PopoverDescription,\n  PopoverHeader,\n  PopoverTitle,\n  PopoverTrigger,\n}\n",
      "type": "registry:ui"
    }
  ],
  "meta": {
    "links": {
      "docs": "https://ui.shadcn.com/docs/components/radix/popover",
      "examples": "https://raw.githubusercontent.com/shadcn-ui/ui/refs/heads/main/apps/v4/registry/bases/radix/examples/popover-example.tsx",
      "api": "https://www.radix-ui.com/docs/primitives/components/popover.md"
    }
  },
  "type": "registry:ui"
}