{
  "$schema": "https://ui.shadcn.com/schema/registry-item.json",
  "name": "empty",
  "files": [
    {
      "path": "registry/radix-mira/ui/empty.tsx",
      "content": "import { cva, type VariantProps } from \"class-variance-authority\"\n\nimport { cn } from \"@/registry/radix-mira/lib/utils\"\n\nfunction Empty({ className, ...props }: React.ComponentProps<\"div\">) {\n  return (\n    <div\n      data-slot=\"empty\"\n      className={cn(\n        \"flex w-full min-w-0 flex-1 flex-col items-center justify-center gap-4 rounded-xl border-dashed p-6 text-center text-balance\",\n        className\n      )}\n      {...props}\n    />\n  )\n}\n\nfunction EmptyHeader({ className, ...props }: React.ComponentProps<\"div\">) {\n  return (\n    <div\n      data-slot=\"empty-header\"\n      className={cn(\"flex max-w-sm flex-col items-center gap-1\", className)}\n      {...props}\n    />\n  )\n}\n\nconst emptyMediaVariants = cva(\n  \"mb-2 flex shrink-0 items-center justify-center [&_svg]:pointer-events-none [&_svg]:shrink-0\",\n  {\n    variants: {\n      variant: {\n        default: \"bg-transparent\",\n        icon: \"flex size-8 shrink-0 items-center justify-center rounded-md bg-muted text-foreground [&_svg:not([class*='size-'])]:size-4\",\n      },\n    },\n    defaultVariants: {\n      variant: \"default\",\n    },\n  }\n)\n\nfunction EmptyMedia({\n  className,\n  variant = \"default\",\n  ...props\n}: React.ComponentProps<\"div\"> & VariantProps<typeof emptyMediaVariants>) {\n  return (\n    <div\n      data-slot=\"empty-icon\"\n      data-variant={variant}\n      className={cn(emptyMediaVariants({ variant, className }))}\n      {...props}\n    />\n  )\n}\n\nfunction EmptyTitle({ className, ...props }: React.ComponentProps<\"div\">) {\n  return (\n    <div\n      data-slot=\"empty-title\"\n      className={cn(\"text-sm font-medium tracking-tight\", className)}\n      {...props}\n    />\n  )\n}\n\nfunction EmptyDescription({ className, ...props }: React.ComponentProps<\"p\">) {\n  return (\n    <div\n      data-slot=\"empty-description\"\n      className={cn(\n        \"text-xs/relaxed text-muted-foreground [&>a]:underline [&>a]:underline-offset-4 [&>a:hover]:text-primary\",\n        className\n      )}\n      {...props}\n    />\n  )\n}\n\nfunction EmptyContent({ className, ...props }: React.ComponentProps<\"div\">) {\n  return (\n    <div\n      data-slot=\"empty-content\"\n      className={cn(\n        \"flex w-full max-w-sm min-w-0 flex-col items-center gap-2 text-xs/relaxed text-balance\",\n        className\n      )}\n      {...props}\n    />\n  )\n}\n\nexport {\n  Empty,\n  EmptyHeader,\n  EmptyTitle,\n  EmptyDescription,\n  EmptyContent,\n  EmptyMedia,\n}\n",
      "type": "registry:ui"
    }
  ],
  "meta": {
    "links": {
      "docs": "https://ui.shadcn.com/docs/components/radix/empty",
      "examples": "https://raw.githubusercontent.com/shadcn-ui/ui/refs/heads/main/apps/v4/registry/bases/radix/examples/empty-example.tsx"
    }
  },
  "type": "registry:ui"
}