{
  "$schema": "https://ui.shadcn.com/schema/registry-item.json",
  "name": "context-menu",
  "files": [
    {
      "path": "registry/radix-maia/ui/context-menu.tsx",
      "content": "\"use client\"\n\nimport * as React from \"react\"\nimport { ContextMenu as ContextMenuPrimitive } from \"radix-ui\"\n\nimport { cn } from \"@/registry/radix-maia/lib/utils\"\nimport { IconPlaceholder } from \"@/app/(create)/components/icon-placeholder\"\n\nfunction ContextMenu({\n  ...props\n}: React.ComponentProps<typeof ContextMenuPrimitive.Root>) {\n  return <ContextMenuPrimitive.Root data-slot=\"context-menu\" {...props} />\n}\n\nfunction ContextMenuTrigger({\n  className,\n  ...props\n}: React.ComponentProps<typeof ContextMenuPrimitive.Trigger>) {\n  return (\n    <ContextMenuPrimitive.Trigger\n      data-slot=\"context-menu-trigger\"\n      className={cn(\"select-none\", className)}\n      {...props}\n    />\n  )\n}\n\nfunction ContextMenuGroup({\n  ...props\n}: React.ComponentProps<typeof ContextMenuPrimitive.Group>) {\n  return (\n    <ContextMenuPrimitive.Group data-slot=\"context-menu-group\" {...props} />\n  )\n}\n\nfunction ContextMenuPortal({\n  ...props\n}: React.ComponentProps<typeof ContextMenuPrimitive.Portal>) {\n  return (\n    <ContextMenuPrimitive.Portal data-slot=\"context-menu-portal\" {...props} />\n  )\n}\n\nfunction ContextMenuSub({\n  ...props\n}: React.ComponentProps<typeof ContextMenuPrimitive.Sub>) {\n  return <ContextMenuPrimitive.Sub data-slot=\"context-menu-sub\" {...props} />\n}\n\nfunction ContextMenuRadioGroup({\n  ...props\n}: React.ComponentProps<typeof ContextMenuPrimitive.RadioGroup>) {\n  return (\n    <ContextMenuPrimitive.RadioGroup\n      data-slot=\"context-menu-radio-group\"\n      {...props}\n    />\n  )\n}\n\nfunction ContextMenuContent({\n  className,\n  ...props\n}: React.ComponentProps<typeof ContextMenuPrimitive.Content> & {\n  side?: \"top\" | \"right\" | \"bottom\" | \"left\"\n}) {\n  return (\n    <ContextMenuPrimitive.Portal>\n      <ContextMenuPrimitive.Content\n        data-slot=\"context-menu-content\"\n        className={cn(\n          \"cn-menu-target cn-menu-translucent z-50 max-h-(--radix-context-menu-content-available-height) min-w-48 origin-(--radix-context-menu-content-transform-origin) overflow-x-hidden overflow-y-auto rounded-2xl bg-popover p-1 text-popover-foreground shadow-2xl ring-1 ring-foreground/5 duration-100 data-[side=bottom]:slide-in-from-top-2 data-[side=left]:slide-in-from-right-2 data-[side=right]:slide-in-from-left-2 data-[side=top]:slide-in-from-bottom-2 data-open:animate-in data-open:fade-in-0 data-open:zoom-in-95 data-closed:animate-out data-closed:fade-out-0 data-closed:zoom-out-95\",\n          className\n        )}\n        {...props}\n      />\n    </ContextMenuPrimitive.Portal>\n  )\n}\n\nfunction ContextMenuItem({\n  className,\n  inset,\n  variant = \"default\",\n  ...props\n}: React.ComponentProps<typeof ContextMenuPrimitive.Item> & {\n  inset?: boolean\n  variant?: \"default\" | \"destructive\"\n}) {\n  return (\n    <ContextMenuPrimitive.Item\n      data-slot=\"context-menu-item\"\n      data-inset={inset}\n      data-variant={variant}\n      className={cn(\n        \"group/context-menu-item relative flex cursor-default items-center gap-2.5 rounded-xl px-3 py-2 text-sm outline-hidden select-none focus:bg-accent focus:text-accent-foreground data-inset:pl-9.5 data-[variant=destructive]:text-destructive data-[variant=destructive]:focus:bg-destructive/10 data-[variant=destructive]:focus:text-destructive dark:data-[variant=destructive]:focus:bg-destructive/20 data-disabled:pointer-events-none data-disabled:opacity-50 [&_svg]:pointer-events-none [&_svg]:shrink-0 [&_svg:not([class*='size-'])]:size-4 focus:*:[svg]:text-accent-foreground data-[variant=destructive]:*:[svg]:text-destructive\",\n        className\n      )}\n      {...props}\n    />\n  )\n}\n\nfunction ContextMenuSubTrigger({\n  className,\n  inset,\n  children,\n  ...props\n}: React.ComponentProps<typeof ContextMenuPrimitive.SubTrigger> & {\n  inset?: boolean\n}) {\n  return (\n    <ContextMenuPrimitive.SubTrigger\n      data-slot=\"context-menu-sub-trigger\"\n      data-inset={inset}\n      className={cn(\n        \"flex cursor-default items-center rounded-xl px-3 py-2 text-sm outline-hidden select-none focus:bg-accent focus:text-accent-foreground data-inset:pl-9.5 data-open:bg-accent data-open:text-accent-foreground [&_svg]:pointer-events-none [&_svg]:shrink-0 [&_svg:not([class*='size-'])]:size-4\",\n        className\n      )}\n      {...props}\n    >\n      {children}\n      <IconPlaceholder\n        lucide=\"ChevronRightIcon\"\n        tabler=\"IconChevronRight\"\n        hugeicons=\"ArrowRight01Icon\"\n        phosphor=\"CaretRightIcon\"\n        remixicon=\"RiArrowRightSLine\"\n        className=\"cn-rtl-flip ml-auto\"\n      />\n    </ContextMenuPrimitive.SubTrigger>\n  )\n}\n\nfunction ContextMenuSubContent({\n  className,\n  ...props\n}: React.ComponentProps<typeof ContextMenuPrimitive.SubContent>) {\n  return (\n    <ContextMenuPrimitive.SubContent\n      data-slot=\"context-menu-sub-content\"\n      className={cn(\n        \"cn-menu-target cn-menu-translucent z-50 min-w-32 origin-(--radix-context-menu-content-transform-origin) overflow-hidden rounded-2xl border bg-popover p-1 text-popover-foreground shadow-lg duration-100 data-[side=bottom]:slide-in-from-top-2 data-[side=left]:slide-in-from-right-2 data-[side=right]:slide-in-from-left-2 data-[side=top]:slide-in-from-bottom-2 data-open:animate-in data-open:fade-in-0 data-open:zoom-in-95 data-closed:animate-out data-closed:fade-out-0 data-closed:zoom-out-95\",\n        className\n      )}\n      {...props}\n    />\n  )\n}\n\nfunction ContextMenuCheckboxItem({\n  className,\n  children,\n  checked,\n  inset,\n  ...props\n}: React.ComponentProps<typeof ContextMenuPrimitive.CheckboxItem> & {\n  inset?: boolean\n}) {\n  return (\n    <ContextMenuPrimitive.CheckboxItem\n      data-slot=\"context-menu-checkbox-item\"\n      data-inset={inset}\n      className={cn(\n        \"relative flex cursor-default items-center gap-2 rounded-xl py-2 pr-8 pl-3 text-sm outline-hidden select-none focus:bg-accent focus:text-accent-foreground data-inset:pl-9.5 data-disabled:pointer-events-none data-disabled:opacity-50 [&_svg]:pointer-events-none [&_svg]:shrink-0 [&_svg:not([class*='size-'])]:size-4\",\n        className\n      )}\n      checked={checked}\n      {...props}\n    >\n      <span className=\"pointer-events-none absolute right-2\">\n        <ContextMenuPrimitive.ItemIndicator>\n          <IconPlaceholder\n            lucide=\"CheckIcon\"\n            tabler=\"IconCheck\"\n            hugeicons=\"Tick02Icon\"\n            phosphor=\"CheckIcon\"\n            remixicon=\"RiCheckLine\"\n          />\n        </ContextMenuPrimitive.ItemIndicator>\n      </span>\n      {children}\n    </ContextMenuPrimitive.CheckboxItem>\n  )\n}\n\nfunction ContextMenuRadioItem({\n  className,\n  children,\n  inset,\n  ...props\n}: React.ComponentProps<typeof ContextMenuPrimitive.RadioItem> & {\n  inset?: boolean\n}) {\n  return (\n    <ContextMenuPrimitive.RadioItem\n      data-slot=\"context-menu-radio-item\"\n      data-inset={inset}\n      className={cn(\n        \"relative flex cursor-default items-center gap-2 rounded-xl py-2 pr-8 pl-3 text-sm outline-hidden select-none focus:bg-accent focus:text-accent-foreground data-inset:pl-9.5 data-disabled:pointer-events-none data-disabled:opacity-50 [&_svg]:pointer-events-none [&_svg]:shrink-0 [&_svg:not([class*='size-'])]:size-4\",\n        className\n      )}\n      {...props}\n    >\n      <span className=\"pointer-events-none absolute right-2\">\n        <ContextMenuPrimitive.ItemIndicator>\n          <IconPlaceholder\n            lucide=\"CheckIcon\"\n            tabler=\"IconCheck\"\n            hugeicons=\"Tick02Icon\"\n            phosphor=\"CheckIcon\"\n            remixicon=\"RiCheckLine\"\n          />\n        </ContextMenuPrimitive.ItemIndicator>\n      </span>\n      {children}\n    </ContextMenuPrimitive.RadioItem>\n  )\n}\n\nfunction ContextMenuLabel({\n  className,\n  inset,\n  ...props\n}: React.ComponentProps<typeof ContextMenuPrimitive.Label> & {\n  inset?: boolean\n}) {\n  return (\n    <ContextMenuPrimitive.Label\n      data-slot=\"context-menu-label\"\n      data-inset={inset}\n      className={cn(\n        \"px-3 py-2.5 text-xs text-muted-foreground data-inset:pl-9.5\",\n        className\n      )}\n      {...props}\n    />\n  )\n}\n\nfunction ContextMenuSeparator({\n  className,\n  ...props\n}: React.ComponentProps<typeof ContextMenuPrimitive.Separator>) {\n  return (\n    <ContextMenuPrimitive.Separator\n      data-slot=\"context-menu-separator\"\n      className={cn(\"-mx-1 my-1 h-px bg-border/50\", className)}\n      {...props}\n    />\n  )\n}\n\nfunction ContextMenuShortcut({\n  className,\n  ...props\n}: React.ComponentProps<\"span\">) {\n  return (\n    <span\n      data-slot=\"context-menu-shortcut\"\n      className={cn(\n        \"ml-auto text-xs tracking-widest text-muted-foreground group-focus/context-menu-item:text-accent-foreground\",\n        className\n      )}\n      {...props}\n    />\n  )\n}\n\nexport {\n  ContextMenu,\n  ContextMenuTrigger,\n  ContextMenuContent,\n  ContextMenuItem,\n  ContextMenuCheckboxItem,\n  ContextMenuRadioItem,\n  ContextMenuLabel,\n  ContextMenuSeparator,\n  ContextMenuShortcut,\n  ContextMenuGroup,\n  ContextMenuPortal,\n  ContextMenuSub,\n  ContextMenuSubContent,\n  ContextMenuSubTrigger,\n  ContextMenuRadioGroup,\n}\n",
      "type": "registry:ui"
    }
  ],
  "meta": {
    "links": {
      "docs": "https://ui.shadcn.com/docs/components/radix/context-menu",
      "examples": "https://raw.githubusercontent.com/shadcn-ui/ui/refs/heads/main/apps/v4/registry/bases/radix/examples/context-menu-example.tsx",
      "api": "https://www.radix-ui.com/docs/primitives/components/context-menu.md"
    }
  },
  "type": "registry:ui"
}