{
  "$schema": "https://ui.shadcn.com/schema/registry-item.json",
  "name": "preview",
  "title": "Preview",
  "registryDependencies": [
    "alert-dialog",
    "avatar",
    "badge",
    "button",
    "button-group",
    "card",
    "checkbox",
    "combobox",
    "dropdown-menu",
    "empty",
    "field",
    "input",
    "input-group",
    "item",
    "label",
    "popover",
    "radio-group",
    "select",
    "separator",
    "sheet",
    "slider",
    "spinner",
    "switch",
    "textarea",
    "tooltip",
    "example"
  ],
  "files": [
    {
      "path": "registry/radix-nova/blocks/preview/index.tsx",
      "content": "\"use client\"\n\nimport { ActivateAgentDialog } from \"@/registry/radix-nova/blocks/preview/cards/activate-agent-dialog\"\nimport { AnalyticsCard } from \"@/registry/radix-nova/blocks/preview/cards/analytics-card\"\nimport { AnomalyAlert } from \"@/registry/radix-nova/blocks/preview/cards/anomaly-alert\"\nimport { AssignIssue } from \"@/registry/radix-nova/blocks/preview/cards/assign-issue\"\nimport { BarChartCard } from \"@/registry/radix-nova/blocks/preview/cards/bar-chart-card\"\nimport { BarVisualizerCard } from \"@/registry/radix-nova/blocks/preview/cards/bar-visualizer\"\nimport { BookAppointment } from \"@/registry/radix-nova/blocks/preview/cards/book-appointment\"\nimport { CodespacesCard } from \"@/registry/radix-nova/blocks/preview/cards/codespaces-card\"\nimport { ContributionsActivity } from \"@/registry/radix-nova/blocks/preview/cards/contributions-activity\"\nimport { Contributors } from \"@/registry/radix-nova/blocks/preview/cards/contributors\"\nimport { EnvironmentVariables } from \"@/registry/radix-nova/blocks/preview/cards/environment-variables\"\nimport { FeedbackForm } from \"@/registry/radix-nova/blocks/preview/cards/feedback-form\"\nimport { FileUpload } from \"@/registry/radix-nova/blocks/preview/cards/file-upload\"\nimport { GithubProfile } from \"@/registry/radix-nova/blocks/preview/cards/github-profile\"\nimport { IconPreviewGrid } from \"@/registry/radix-nova/blocks/preview/cards/icon-preview-grid\"\nimport { InviteTeam } from \"@/registry/radix-nova/blocks/preview/cards/invite-team\"\nimport { Invoice } from \"@/registry/radix-nova/blocks/preview/cards/invoice\"\nimport { LiveWaveformCard } from \"@/registry/radix-nova/blocks/preview/cards/live-waveform\"\nimport { NoTeamMembers } from \"@/registry/radix-nova/blocks/preview/cards/no-team-members\"\nimport { NotFound } from \"@/registry/radix-nova/blocks/preview/cards/not-found\"\nimport { ObservabilityCard } from \"@/registry/radix-nova/blocks/preview/cards/observability-card\"\nimport { PieChartCard } from \"@/registry/radix-nova/blocks/preview/cards/pie-chart-card\"\nimport { ReportBug } from \"@/registry/radix-nova/blocks/preview/cards/report-bug\"\nimport { ShippingAddress } from \"@/registry/radix-nova/blocks/preview/cards/shipping-address\"\nimport { Shortcuts } from \"@/registry/radix-nova/blocks/preview/cards/shortcuts\"\nimport { SkeletonLoading } from \"@/registry/radix-nova/blocks/preview/cards/skeleton-loading\"\nimport { SleepReport } from \"@/registry/radix-nova/blocks/preview/cards/sleep-report\"\nimport { StyleOverview } from \"@/registry/radix-nova/blocks/preview/cards/style-overview\"\nimport { UIElements } from \"@/registry/radix-nova/blocks/preview/cards/ui-elements\"\nimport { UsageCard } from \"@/registry/radix-nova/blocks/preview/cards/usage-card\"\nimport { Visitors } from \"@/registry/radix-nova/blocks/preview/cards/visitors\"\nimport { WeeklyFitnessSummary } from \"@/registry/radix-nova/blocks/preview/cards/weekly-fitness-summary\"\n\nexport default function PreviewExample() {\n  return (\n    <div className=\"overflow-x-auto overflow-y-hidden contain-[paint] [--gap:--spacing(4)] 3xl:[--gap:--spacing(12)] md:[--gap:--spacing(10)]\">\n      <div\n        className=\"grid w-[2400px] grid-cols-7 items-start gap-(--gap) bg-muted p-(--gap) md:w-[3000px] dark:bg-background *:[div]:gap-(--gap)\"\n        data-slot=\"capture-target\"\n      >\n        <div className=\"flex flex-col p-px [contain-intrinsic-size:380px_1200px] [content-visibility:auto]\">\n          <StyleOverview />\n          <div className=\"md:hidden\">\n            <UIElements />\n          </div>\n          <CodespacesCard />\n          <BarVisualizerCard />\n          <Invoice />\n        </div>\n        <div className=\"flex flex-col p-px [contain-intrinsic-size:380px_1200px] [content-visibility:auto]\">\n          <IconPreviewGrid />\n          <div className=\"hidden w-full md:flex\">\n            <UIElements />\n          </div>\n          <ObservabilityCard />\n          <Visitors />\n          <Shortcuts />\n        </div>\n        <div className=\"flex flex-col p-px [contain-intrinsic-size:380px_1200px] [content-visibility:auto]\">\n          <EnvironmentVariables />\n          <BarChartCard />\n          <InviteTeam />\n          <ActivateAgentDialog />\n        </div>\n        <div className=\"flex flex-col p-px [contain-intrinsic-size:380px_1200px] [content-visibility:auto]\">\n          <SkeletonLoading />\n          <PieChartCard />\n          <NoTeamMembers />\n          <ReportBug />\n          <Contributors />\n        </div>\n        <div className=\"flex flex-col p-px [contain-intrinsic-size:380px_1200px] [content-visibility:auto]\">\n          <FeedbackForm />\n          <BookAppointment />\n          <SleepReport />\n          <GithubProfile />\n        </div>\n        <div className=\"flex flex-col p-px [contain-intrinsic-size:380px_1200px] [content-visibility:auto]\">\n          <AssignIssue />\n          <WeeklyFitnessSummary />\n          <FileUpload />\n          <AnalyticsCard />\n          <UsageCard />\n          <ContributionsActivity />\n        </div>\n        <div className=\"flex flex-col p-px [contain-intrinsic-size:380px_1200px] [content-visibility:auto]\">\n          <AnomalyAlert />\n          <LiveWaveformCard />\n          <ShippingAddress />\n          <NotFound />\n        </div>\n      </div>\n    </div>\n  )\n}\n",
      "type": "registry:block"
    }
  ],
  "type": "registry:block"
}