{
  "$schema": "https://ui.shadcn.com/schema/registry-item.json",
  "name": "skeleton",
  "files": [
    {
      "path": "registry/radix-lyra/ui/skeleton.tsx",
      "content": "import { cn } from \"@/registry/radix-lyra/lib/utils\"\n\nfunction Skeleton({ className, ...props }: React.ComponentProps<\"div\">) {\n  return (\n    <div\n      data-slot=\"skeleton\"\n      className={cn(\"animate-pulse rounded-none bg-muted\", className)}\n      {...props}\n    />\n  )\n}\n\nexport { Skeleton }\n",
      "type": "registry:ui"
    }
  ],
  "meta": {
    "links": {
      "docs": "https://ui.shadcn.com/docs/components/radix/skeleton",
      "examples": "https://raw.githubusercontent.com/shadcn-ui/ui/refs/heads/main/apps/v4/registry/bases/radix/examples/skeleton-example.tsx"
    }
  },
  "type": "registry:ui"
}