{
  "$schema": "https://ui.shadcn.com/schema/registry-item.json",
  "name": "textarea",
  "files": [
    {
      "path": "registry/radix-nova/ui/textarea.tsx",
      "content": "import * as React from \"react\"\n\nimport { cn } from \"@/registry/radix-nova/lib/utils\"\n\nfunction Textarea({ className, ...props }: React.ComponentProps<\"textarea\">) {\n  return (\n    <textarea\n      data-slot=\"textarea\"\n      className={cn(\n        \"flex field-sizing-content min-h-16 w-full rounded-lg border border-input bg-transparent px-2.5 py-2 text-base transition-colors outline-none placeholder:text-muted-foreground focus-visible:border-ring focus-visible:ring-3 focus-visible:ring-ring/50 disabled:cursor-not-allowed disabled:bg-input/50 disabled:opacity-50 aria-invalid:border-destructive aria-invalid:ring-3 aria-invalid:ring-destructive/20 md:text-sm dark:bg-input/30 dark:disabled:bg-input/80 dark:aria-invalid:border-destructive/50 dark:aria-invalid:ring-destructive/40\",\n        className\n      )}\n      {...props}\n    />\n  )\n}\n\nexport { Textarea }\n",
      "type": "registry:ui"
    }
  ],
  "meta": {
    "links": {
      "docs": "https://ui.shadcn.com/docs/components/radix/textarea",
      "examples": "https://raw.githubusercontent.com/shadcn-ui/ui/refs/heads/main/apps/v4/registry/bases/radix/examples/textarea-example.tsx"
    }
  },
  "type": "registry:ui"
}