{
  "$schema": "https://ui.shadcn.com/schema/registry-item.json",
  "name": "sheet",
  "registryDependencies": [
    "button"
  ],
  "files": [
    {
      "path": "registry/radix-nova/ui/sheet.tsx",
      "content": "\"use client\"\n\nimport * as React from \"react\"\nimport { Dialog as SheetPrimitive } from \"radix-ui\"\n\nimport { cn } from \"@/registry/radix-nova/lib/utils\"\nimport { Button } from \"@/registry/radix-nova/ui/button\"\nimport { IconPlaceholder } from \"@/app/(create)/components/icon-placeholder\"\n\nfunction Sheet({ ...props }: React.ComponentProps<typeof SheetPrimitive.Root>) {\n  return <SheetPrimitive.Root data-slot=\"sheet\" {...props} />\n}\n\nfunction SheetTrigger({\n  ...props\n}: React.ComponentProps<typeof SheetPrimitive.Trigger>) {\n  return <SheetPrimitive.Trigger data-slot=\"sheet-trigger\" {...props} />\n}\n\nfunction SheetClose({\n  ...props\n}: React.ComponentProps<typeof SheetPrimitive.Close>) {\n  return <SheetPrimitive.Close data-slot=\"sheet-close\" {...props} />\n}\n\nfunction SheetPortal({\n  ...props\n}: React.ComponentProps<typeof SheetPrimitive.Portal>) {\n  return <SheetPrimitive.Portal data-slot=\"sheet-portal\" {...props} />\n}\n\nfunction SheetOverlay({\n  className,\n  ...props\n}: React.ComponentProps<typeof SheetPrimitive.Overlay>) {\n  return (\n    <SheetPrimitive.Overlay\n      data-slot=\"sheet-overlay\"\n      className={cn(\n        \"fixed inset-0 z-50 bg-black/10 duration-100 supports-backdrop-filter:backdrop-blur-xs data-open:animate-in data-open:fade-in-0 data-closed:animate-out data-closed:fade-out-0\",\n        className\n      )}\n      {...props}\n    />\n  )\n}\n\nfunction SheetContent({\n  className,\n  children,\n  side = \"right\",\n  showCloseButton = true,\n  ...props\n}: React.ComponentProps<typeof SheetPrimitive.Content> & {\n  side?: \"top\" | \"right\" | \"bottom\" | \"left\"\n  showCloseButton?: boolean\n}) {\n  return (\n    <SheetPortal>\n      <SheetOverlay />\n      <SheetPrimitive.Content\n        data-slot=\"sheet-content\"\n        data-side={side}\n        className={cn(\n          \"fixed z-50 flex flex-col gap-4 bg-background bg-clip-padding text-sm shadow-lg transition duration-200 ease-in-out data-[side=bottom]:inset-x-0 data-[side=bottom]:bottom-0 data-[side=bottom]:h-auto data-[side=bottom]:border-t data-[side=left]:inset-y-0 data-[side=left]:left-0 data-[side=left]:h-full data-[side=left]:w-3/4 data-[side=left]:border-r data-[side=right]:inset-y-0 data-[side=right]:right-0 data-[side=right]:h-full data-[side=right]:w-3/4 data-[side=right]:border-l data-[side=top]:inset-x-0 data-[side=top]:top-0 data-[side=top]:h-auto data-[side=top]:border-b data-[side=left]:sm:max-w-sm data-[side=right]:sm:max-w-sm data-open:animate-in data-open:fade-in-0 data-[side=bottom]:data-open:slide-in-from-bottom-10 data-[side=left]:data-open:slide-in-from-left-10 data-[side=right]:data-open:slide-in-from-right-10 data-[side=top]:data-open:slide-in-from-top-10 data-closed:animate-out data-closed:fade-out-0 data-[side=bottom]:data-closed:slide-out-to-bottom-10 data-[side=left]:data-closed:slide-out-to-left-10 data-[side=right]:data-closed:slide-out-to-right-10 data-[side=top]:data-closed:slide-out-to-top-10\",\n          className\n        )}\n        {...props}\n      >\n        {children}\n        {showCloseButton && (\n          <SheetPrimitive.Close data-slot=\"sheet-close\" asChild>\n            <Button\n              variant=\"ghost\"\n              className=\"absolute top-3 right-3\"\n              size=\"icon-sm\"\n            >\n              <IconPlaceholder\n                lucide=\"XIcon\"\n                tabler=\"IconX\"\n                hugeicons=\"Cancel01Icon\"\n                phosphor=\"XIcon\"\n                remixicon=\"RiCloseLine\"\n              />\n              <span className=\"sr-only\">Close</span>\n            </Button>\n          </SheetPrimitive.Close>\n        )}\n      </SheetPrimitive.Content>\n    </SheetPortal>\n  )\n}\n\nfunction SheetHeader({ className, ...props }: React.ComponentProps<\"div\">) {\n  return (\n    <div\n      data-slot=\"sheet-header\"\n      className={cn(\"flex flex-col gap-0.5 p-4\", className)}\n      {...props}\n    />\n  )\n}\n\nfunction SheetFooter({ className, ...props }: React.ComponentProps<\"div\">) {\n  return (\n    <div\n      data-slot=\"sheet-footer\"\n      className={cn(\"mt-auto flex flex-col gap-2 p-4\", className)}\n      {...props}\n    />\n  )\n}\n\nfunction SheetTitle({\n  className,\n  ...props\n}: React.ComponentProps<typeof SheetPrimitive.Title>) {\n  return (\n    <SheetPrimitive.Title\n      data-slot=\"sheet-title\"\n      className={cn(\"text-base font-medium text-foreground\", className)}\n      {...props}\n    />\n  )\n}\n\nfunction SheetDescription({\n  className,\n  ...props\n}: React.ComponentProps<typeof SheetPrimitive.Description>) {\n  return (\n    <SheetPrimitive.Description\n      data-slot=\"sheet-description\"\n      className={cn(\"text-sm text-muted-foreground\", className)}\n      {...props}\n    />\n  )\n}\n\nexport {\n  Sheet,\n  SheetTrigger,\n  SheetClose,\n  SheetContent,\n  SheetHeader,\n  SheetFooter,\n  SheetTitle,\n  SheetDescription,\n}\n",
      "type": "registry:ui"
    }
  ],
  "meta": {
    "links": {
      "docs": "https://ui.shadcn.com/docs/components/radix/sheet",
      "examples": "https://raw.githubusercontent.com/shadcn-ui/ui/refs/heads/main/apps/v4/registry/bases/radix/examples/sheet-example.tsx",
      "api": "https://www.radix-ui.com/docs/primitives/components/dialog.md"
    }
  },
  "type": "registry:ui"
}