{
  "$schema": "https://ui.shadcn.com/schema/registry-item.json",
  "name": "input",
  "files": [
    {
      "path": "registry/radix-vega/ui/input.tsx",
      "content": "import * as React from \"react\"\n\nimport { cn } from \"@/registry/radix-vega/lib/utils\"\n\nfunction Input({ className, type, ...props }: React.ComponentProps<\"input\">) {\n  return (\n    <input\n      type={type}\n      data-slot=\"input\"\n      className={cn(\n        \"h-9 w-full min-w-0 rounded-md border border-input bg-transparent px-2.5 py-1 text-base shadow-xs transition-[color,box-shadow] outline-none file:inline-flex file:h-7 file:border-0 file:bg-transparent file:text-sm file:font-medium file:text-foreground placeholder:text-muted-foreground focus-visible:border-ring focus-visible:ring-3 focus-visible:ring-ring/50 disabled:pointer-events-none disabled:cursor-not-allowed disabled:opacity-50 aria-invalid:border-destructive aria-invalid:ring-3 aria-invalid:ring-destructive/20 md:text-sm dark:bg-input/30 dark:aria-invalid:border-destructive/50 dark:aria-invalid:ring-destructive/40\",\n        className\n      )}\n      {...props}\n    />\n  )\n}\n\nexport { Input }\n",
      "type": "registry:ui"
    }
  ],
  "meta": {
    "links": {
      "docs": "https://ui.shadcn.com/docs/components/radix/input",
      "examples": "https://raw.githubusercontent.com/shadcn-ui/ui/refs/heads/main/apps/v4/registry/bases/radix/examples/input-example.tsx"
    }
  },
  "type": "registry:ui"
}