{
  "$schema": "https://ui.shadcn.com/schema/registry-item.json",
  "name": "font-roboto",
  "title": "Roboto",
  "type": "registry:font",
  "font": {
    "family": "'Roboto Variable', sans-serif",
    "provider": "google",
    "import": "Roboto",
    "variable": "--font-sans",
    "subsets": [
      "latin"
    ]
  }
}