{
  "$schema": "https://ui.shadcn.com/schema/registry-item.json",
  "name": "tooltip",
  "files": [
    {
      "path": "registry/radix-maia/ui/tooltip.tsx",
      "content": "\"use client\"\n\nimport * as React from \"react\"\nimport { Tooltip as TooltipPrimitive } from \"radix-ui\"\n\nimport { cn } from \"@/registry/radix-maia/lib/utils\"\n\nfunction TooltipProvider({\n  delayDuration = 0,\n  ...props\n}: React.ComponentProps<typeof TooltipPrimitive.Provider>) {\n  return (\n    <TooltipPrimitive.Provider\n      data-slot=\"tooltip-provider\"\n      delayDuration={delayDuration}\n      {...props}\n    />\n  )\n}\n\nfunction Tooltip({\n  ...props\n}: React.ComponentProps<typeof TooltipPrimitive.Root>) {\n  return <TooltipPrimitive.Root data-slot=\"tooltip\" {...props} />\n}\n\nfunction TooltipTrigger({\n  ...props\n}: React.ComponentProps<typeof TooltipPrimitive.Trigger>) {\n  return <TooltipPrimitive.Trigger data-slot=\"tooltip-trigger\" {...props} />\n}\n\nfunction TooltipContent({\n  className,\n  sideOffset = 0,\n  children,\n  ...props\n}: React.ComponentProps<typeof TooltipPrimitive.Content>) {\n  return (\n    <TooltipPrimitive.Portal>\n      <TooltipPrimitive.Content\n        data-slot=\"tooltip-content\"\n        sideOffset={sideOffset}\n        className={cn(\n          \"z-50 inline-flex w-fit max-w-xs origin-(--radix-tooltip-content-transform-origin) items-center gap-1.5 rounded-2xl bg-foreground px-3 py-1.5 text-xs text-background has-data-[slot=kbd]:pr-1.5 data-[side=bottom]:slide-in-from-top-2 data-[side=left]:slide-in-from-right-2 data-[side=right]:slide-in-from-left-2 data-[side=top]:slide-in-from-bottom-2 **:data-[slot=kbd]:relative **:data-[slot=kbd]:isolate **:data-[slot=kbd]:z-50 **:data-[slot=kbd]:rounded-4xl data-[state=delayed-open]:animate-in data-[state=delayed-open]:fade-in-0 data-[state=delayed-open]:zoom-in-95 data-open:animate-in data-open:fade-in-0 data-open:zoom-in-95 data-closed:animate-out data-closed:fade-out-0 data-closed:zoom-out-95\",\n          className\n        )}\n        {...props}\n      >\n        {children}\n        <TooltipPrimitive.Arrow className=\"z-50 size-2.5 translate-y-[calc(-50%_-_2px)] rotate-45 rounded-[2px] bg-foreground fill-foreground data-[side=left]:translate-x-[-1.5px] data-[side=right]:translate-x-[1.5px]\" />\n      </TooltipPrimitive.Content>\n    </TooltipPrimitive.Portal>\n  )\n}\n\nexport { Tooltip, TooltipContent, TooltipProvider, TooltipTrigger }\n",
      "type": "registry:ui"
    }
  ],
  "meta": {
    "links": {
      "docs": "https://ui.shadcn.com/docs/components/radix/tooltip",
      "examples": "https://raw.githubusercontent.com/shadcn-ui/ui/refs/heads/main/apps/v4/registry/bases/radix/examples/tooltip-example.tsx",
      "api": "https://www.radix-ui.com/docs/primitives/components/tooltip.md"
    }
  },
  "docs": "The `tooltip` component has been added. Remember to wrap your app with the `TooltipProvider` component.\n\n```tsx title=\"app/layout.tsx\"\nimport { TooltipProvider } from \"@/components/ui/tooltip\"\n\nexport default function RootLayout({ children }: { children: React.ReactNode }) {\n  return (\n    <html lang=\"en\">\n      <body>\n        <TooltipProvider>{children}</TooltipProvider>\n      </body>\n    </html>\n  )\n}\n```\n",
  "type": "registry:ui"
}